id,shortname,longname,nif,description,address,capitalsocial,regdate
1,EUROPEA,"EUROPEA DE TITULIZACION, S.A., S.G.F.T.",A-80514466,"EUROPEA DE TITULIZACION","C/ LAGASCA Nº 120 - 28006 MADRID (MADRID)",1803037.50,1993-03-30
2,GESTICAIXA,"GESTICAIXA, S.G.F.T., S.A.",A-58481227,GESTICAIXA,"PEDRO I PONS, 9-11 - 08034 BARCELONA (BARCELONA)",1502500.00,1994-11-03
3,GAT,"GESTION DE ACTIVOS TITULIZADOS, SGFT, S.A.",A-61604955,"GESTION DE ACTIVOS TITULIZADOS","C/ ROURE, 6-8 (POLIGON INDUSTRIAL MAS MATEU) - 08820 EL PRAT DE LLOBREGAT (BARCELONA)",1000050.00,1998-04-24
4,HAYA,"HAYA TITULIZACION, SGFT, S.A.",A80732142,"HAYA TITULIZACION","VIA DE LOS POBLADOS 3, EDIFICIO 9 - 28033 MADRID (MADRID)",1000003.90,1994-03-22
5,INTERMONEY,"INTERMONEY TITULIZACION, S.G.F.T., S.A.",A-83774885,"INTERMONEY TITULIZACION","C/ PRÍNCIPE DE VERGARA 131, PLANTA 3ª - 28002 MADRID (MADRID)",1000000.00,2003-10-30
6,SANTANDER,"SANTANDER DE TITULIZACION, SGFT, S.A.",A-80481419,"SANTANDER DE TITULIZACION","AVDA. GRAN VIA DE HORTALEZA 3 - 28033 MADRID (MADRID)",901650.00,1993-02-10
7,TDA,"TITULIZACION DE ACTIVOS, S.A., S.G.F.T.",A-80352750,"TITULIZACION DE ACTIVOS","ORENSE 69 - 28020 MADRID (MADRID)",903000.00,1993-06-16
